{"dependency_versions":{"PyYAML":"6.0.3","jsonschema":"4.26.0"},"entrypoint":"research/b1-context/tools/evaluate_v1.py","files":[{"artifact_bytes_sha256":"sha256:69cd318cd6ec1c65e0ed5805c7a8ad950caf0def0ab9fb87f78a53b49ed00136","relative_path":"research/b1-context/schema/evaluation-contract-v1-r3.schema.json"},{"artifact_bytes_sha256":"sha256:b81e2376d4ec15d49d1adaf25459f8e69f12ca2bdff4d03de71d0470ab44d5d1","relative_path":"research/b1-context/schema/evaluation-output-v1-r2.schema.json"},{"artifact_bytes_sha256":"sha256:c6142b76b1956276eb00966f0ca7f0047b0b8f4d4c24bb46da167ee7a42b9138","relative_path":"research/b1-context/schema/evaluator-implementation-manifest-v0-r2.schema.json"},{"artifact_bytes_sha256":"sha256:e41eba0587323d8ec183d66adebe32ebaa23d3df65953d1ab15febcaae5db12f","relative_path":"research/b1-context/tools/evaluate_v1.py"},{"artifact_bytes_sha256":"sha256:02c4ad791d1ae4945d369145a6b8a370d402dae287db6a58b7e0927ba3c78a2c","relative_path":"research/b1-context/tools/o7b1/__init__.py"},{"artifact_bytes_sha256":"sha256:5ae7df10671a1d03d8ca458e7939b3fbd2632a113f32811a121f73b19dcb6281","relative_path":"research/b1-context/tools/o7b1/canonical.py"},{"artifact_bytes_sha256":"sha256:9f22d5248ee512752e581d6e8795e33e94ac9fc0d75630aeec60b89f73ff54b5","relative_path":"research/b1-context/tools/o7b1/evaluate_v1.py"},{"artifact_bytes_sha256":"sha256:7551ae1eab67ed2b83216481fa1344eea744646c127fb2ad1c4770eceb672ff2","relative_path":"research/b1-context/tools/o7b1/validity.py"}],"python_version":"3.14.6","schema":"o7.b1.evaluator-implementation-manifest/v0","schema_note":"Path-uniqueness by normalized relative_path and entrypoint-presence in files are evaluator consistency checks, not expressible in JSON Schema draft 2020-12."}
